key,name,Req. Tool,Req. Room,prog_type,prog_count,tier,type,win,Ready?,reward,Description,Win Message,Loss Message,,Chinese - Name,Chinese - Description,Chinese - Win,Chinese - Lose,Spanish,Description,Win,Lose,French,Description,Win,Lose,Japanese,Description,Win,Lose,Portuguese,Description,Win,Lose,Korean,Description,Win,Lose
atm_1_baubles,Гнилые безделушки,,,count,2,2,forage,25,Testable,itm_leaf_3,Диллфорд просит 2 Гнилых Безделушки из канализации. Положите их в Продуктовый ящик.,Дилфорд получил свои образцы Гнили.,Просьба Дилформа осталась невыполненной.,,,,,,,,,,,,,,,,,,,,,,,,,
atm_2_cornerstones,Краеугольные камни,,,count,3,2,forage,20,Testable,itm_leaf_3,"Хаупиа хочет, чтобы мы начали строить опору из Краеугольного камня чтобы полы не расшатались. Трех штук в Продуктовом ящике будет достаточно.",Деревенские с Пантаций укрепили своим фундаменты.,Просьба для Деревни Плантация не выполнена.,,,,,,,,,,,,,,,,,,,,,,,,,
atm_2_package,Подпружиненный,,,count,4,2,forage,25,Idea,itm_leaf_3,Фундаменты Осеннего города разваливаются. Груз Известняка ждет в бухте Ракушек чтобы доставить его в Свежую Прогулку.,Кало смог использовать Известняк для ремонта!,Осенний город не получил необходимых ему ресурсов.,,,,,,,,,,,,,,,,,,,,,,,,,
atm_2_cobblestone,Экспорт Булыжника,inv_shld_seedbag,,count,4,3,forage,45,Testable,itm_leaf_3,"Мы хотели бы получить Булыжник, чтобы содержать в порядке то, что осталось от дорог Осеннего города. Мы просим 4 штуки в Продуктовом ящике.",Кало смог использовать Булыжник для ремонта!,Осенний город не получил необходимых ему ресурсов.,,,,,,,,,,,,,,,,,,,,,,,,,
atm_2_gardenseed,День посадки,inv_shld_seedbag,,count,10,3,forage,45,Idea,itm_leaf_4,"Фермеры просят вас посадить 10 новых семян, чтобы помочь распространить их по всей Роще!",Просьба выполнена успешно,Просьба провалена,,,,,,,,,,,,,,,,,,,,,,,,,
atm_3_candlewax,,inv_seed_kukui,,count,3,3,forage,45,Idea,itm_leaf_4,,Просьба выполнена успешно,Просьба провалена,,,,,,,,,,,,,,,,,,,,,,,,,
atm_3_chickpea,,inv_seed_chickpea,,count,3,2,forage,30,Idea,,,,,,,,,,,,,,,,,,,,,,,,,,,,,
atm_3_ac_screws,Очистка канализации,,r_sewer_a,count,5,3,forage,25,Testable,itm_leaf_4,"В канализации куча неразлагаемого металла. Нам нужно, чтобы кто-то подобрал там 5 винтов, чтобы они не заржавели и не загрязнили наши воды.",Канализация была должным образом очищена от металлов!,Воды Осеннего города становятся загрязненными.,,,,,,,,,,,,,,,,,,,,,,,,,
,,,,,,,,,,,,,,,,,,,,,,,,,,,,,,,,,,,,,,
Winter Thicket,,,,,,,,,,,,,,,,,,,,,,,,,,,,,,,,,,,,,,
wntr_1f_fatwood,Немного Растопки,,,count,2,1,forage,20,Testable,itm_leaf_2,В городе становится прохладно. Сейчас было бы самое время собрать растопку! Два Толстых дерева в Продуктовом ящике были бы в самый раз!,Костры на Полянах не погасли.,Костры Полян чуть было не погасли.,,,,,,,,,,,,,,,,,,,,,,,,,
wntr_2f_fatwood,Больше Растопки,,,count,4,2,forage,35,Testable,itm_leaf_3,"В городе становится холодно. Нам нужны припасы, чтобы пополнить запасы растопки! Четыре Толстых дерева в Продуктовом ящике сослужили бы хорошую службу.",Поляна спит в тепле.,Ночью в Поляне становится очень холодно.,,,,,,,,,,,,,,,,,,,,,,,,,
wntr_3f_fatwood,Сжечь кучу,,,count,6,3,forage,55,Testable,itm_leaf_4,"Снег на Полянах неумолим. Ледиди говорит, что 6 Толстых деревьев помогут нам переночевать в таких условиях.",Сегодня на Поляне было тепло.,Сегодня все спали на холоде.,,,,,,,,,,,,,,,,,,,,,,,,,
wntr_1f_moonkelp,Водоросли в котле,,,count,1,2,forage,20,Done,itm_leaf_3,Котел на Зимней Поляне становится более пустым. Если бы кто-нибудь мог найти немного Лунных Водорослей и положить их в Продуктовый ящик было бы хорошо.,Мандарин смог наполнить Котел до краев!,У Мандарина было много трудностей с его работой.,,,,,,,,,,,,,,,,,,,,,,,,,
wntr_1f_tombstone,Летние камни,,,count,3,1,forage,30,,itm_leaf_2,"Летний Бар изучает способы удержания температуры так же, как и мы. Если мы сможем собрать 3 Надгробия, это им очень поможет!","Застава получила Надгробия, в которых они нуждались!",Никому не интересны проблемы Заставы.,,,,,,,,,,,,,,,,,,,,,,,,,
wntr_2f_bough,Hot Hot Heat,,,count,3,3,forage,30,Idea,itm_leaf_4,The Central Furnace's flame is about to die. We critically need larger kindling to sustain a larger fire.,,,,,,,,,,,,,,,,,,,,,,,,,,,
wntr_3f_garden,Spring Supplies,,,single,1,3,forage,30,Idea,itm_leaf_4,Firekeepers in the Hamlet need someone to fetch a wood shipment from the Grove Crossroads in Spring Hamlet.,Forage Request Succeeded,Forage Request Failed,,,,,,,,,,,,,,,,,,,,,,,,,
wntr_3f_bauble,Sewer Studies,,,count,2,3,forage,65,Testable,itm_leaf_4,"Ledidi is asking for a couple of Rot Baubles from the Sewers. Not easy, but they're quite adamant that it's necessary for their work.",Ledidi was able to conduct some studies on the Rot!,The Rot's mysteries continue to persist.,,,,,,,,,,,,,,,,,,,,,,,,,
wntr_2f_ac_delivery,Kinder Kindling,,,single,1,2,forage,45,Idea,itm_leaf_3,"Our request to the Hamlet for Central Furnace wood burning supplies was fulfilled, and a package is waiting on the west end of Twilight Paddy!  Watch out, it's quite heavy!",Wood supplies helped keep the Chimneys on!,"The Glade is experiencing a cold, cold night.",,,,,,,,,,,,,,,,,,,,,,,,,
wntr_2f_ac_dew,Hanging Clouds,,r_winterglade,group,3,2,forage,30,Done,itm_leaf_2,"Some people in Winter Glade are feeling the effects of the smoke. To snap them out of this haze, someone needs use Dew in their vicinity before they go home at nightfall!",The villager's ailments were properly tended!,Villagers went to bed with an awful headache.,,,,,,,,,,,,,,,,,,,,,,,,,
,,,,,,,,,,,,,,,,,,,,,,,,,,,,,,,,,,,,,,
wntr_1m_chimney0,Chimney Sweeping,,r_mistyclearing,group,3,1,maintenance,15,Done,itm_leaf_2,A few Chimneys in Misty Clearing need to be repaired. They can be thermally re-sealed with Tombstone.,The Chimneys were properly maintained!,Emergency resources had to be used to fix the Chimneys.,,,,,,,,,,,,,,,,,,,,,,,,,
wntr_1m_chimney1,Colder Collections,,r_brokenblockade,group,3,1,maintenance,20,Done,itm_leaf_2,The local Archive has been feeling a bit cold. I think the outside Chimneys are broken. Could someone change out their Tombstone so I don't freeze in here?,The Chimneys were properly maintained!,Emergency resources had to be used to fix the Chimneys.,,,,,,,,,,,,,,,,,,,,,,,,,
wntr_3m_mists_toggle,Misty Stacks Puzzle,,r_themists,single,1,3,maintenance,50,Idea,itm_leaf_4,Plum used to maintain some old structures in the Mists. We need a Guardian to head in there and find some broken pads.,,,,,,,,,,,,,,,,,,,,,,,,,,,
wntr_3m_mists_dowsing,Misty Waterlog Puzzle,,,single,1,3,maintenance,50,Idea,itm_leaf_4,Plum used to maintain some old structures in the Mists. We need a Guardian to head in there and find a few dowsing levers.,,,,,,,,,,,,,,,,,,,,,,,,,,,
wntr_3m_mists_push,Misty Push Puzzle,,,single,1,3,maintenance,50,Idea,itm_leaf_4,Plum used to maintain some old structures in the Mists. We need a Guardian to head in there and find a few misplaced push-boxes.,,,,,,,,,,,,,,,,,,,,,,,,,,,
wntr_2m_ac_leaks,Ruptured Furnace,,r_winterglade,group,3,2,maintenance,30,Done,itm_leaf_3,"A few heat-distribution lines have busted open, spewing smoke all over the Glade! I think someone could patch the leaks with some of the sap that grows in Twilight Paddy.",Further pollution in the Glade was prevented!,Heat and smoke spilled all over the Glade.,,,,,,,,,,,,,,,,,,,,,,,,,
wntr_2m_ac_furnace,Piping Hot Problem,,r_wonderpond,group,2,3,maintenance,50,Done,itm_leaf_4,A huge line to our furnace has busted open in Wonder Pond! The rot are gathering around the anomaly. Patch the leak up with sap before it's able to reach Pelo!,Further pollution in the Glade was prevented!,Heat and smoke spilled all over the Glade.,,,,,,,,,,,,,,,,,,,,,,,,,
,,,,,,,,,,,,,,,,,,,,,,,,,,,,,,,,,,,,,,
wntr_1c_mists,Foe in the Fog,,r_themists,count,5,1,conflict,10,Testable,itm_leaf_2,The Glade grows thick with Rot. We're asking anyone who can enter the Mists to clear 5 Rot within there before they enter the town.,The Rot was unable to congeal properly in the Glade.,"The Rot's danger went unanswered, harming our buildings.",,,,,,,,,,,,,,,,,,,,,,,,,
wntr_1c_paddy,Paddy Perils,,r_twilightpaddy,group,3,1,conflict,10,Testable,itm_leaf_2,A group of Rot have cut off our guards from the rest of Winter Glade. Please clear them out of Twilight Paddy.,Twilight Paddy remains safe for everyone!,Villagers were unable to gather in Twilight Paddy.,,,,,,,,,,,,,,,,,,,,,,,,,
wntr_2c_package,Rot Retrieval,,r_brokenblockade,single,1,2,conflict,30,Unstarted,itm_leaf_3,Some oozes have taken custody of a shipment of dry wood in Cube Coast. Someone needs to return the package to Winter Glade.,The shipment was properly protected!,The Rot ate our precious wood!,,,,,,,,,,,,,,,,,,,,,,,,,
wntr_3c_glomp,Fetid Fireside,,r_winterglade,group,3,3,conflict,40,Testable,itm_leaf_4,Two Glomps have been cozying up next to the furnace at night! We need to get rid of them before they damage the heating system!,The Furnace is safe and protected.,"The Rot stayed warm and cozy, but the Furnace was damaged.",,,,,,,,,,,,,,,,,,,,,,,,,
wntr_3c_mists,Mucky Mists,,r_themists,single,1,3,conflict,60,Unstarted,itm_leaf_4,Glomp in the mists.,,,,,,,,,,,,,,,,,,,,,,,,,,,
