 ,town,Title,Sprite,Description,Begin Objective,room,Obj A,room,Obj B,room,Obj C,room,Completion Obj,room,Chinese - Title,Chinese - Desc,Chinese - Start Obj,Chinese - Obj A,Chinese - Obj B,Chinese - Obj C,Chinese - Final Obj,Spanish - Title,Spanish - Desc,Spanish Star Obj,Spanish - Obj A,Spanish - Obj B,Spanish - Obj C,Spanish - Final Obj,French - Title,French - Desc,French - Start Obj,French - Obj A,French - Obj B,French - Obj C,French - Final Obj,Japanese - Title,Japanese - Desc,Japanese - Start Obj,Japanese - Obj A,Japanese - Obj B,Japanese - Obj C,Japanese - Final Obj,Portuguese - Title,Portuguese - Desc,Portuguese - Start Obj,Portuguese - Obj A,Portuguese - Obj B,Portuguese - Obj C,Portuguese - Final Obj,Korean - Title,Korean - Desc,Korean - Start Obj,Korean - Obj A,Korean - Obj B,Korean - Obj C,Korean - Final Obj,Spanish - Start Obj
tutorial0,Spring Hamlet,Tutorial A,0,,Filler,r_kindergarden,,,,,,,Head towards Spring Hamlet.,r_springhamlet,Tutorial A,,Filler,,Squash the Rot blocking your way.,,Head towards Spring Hamlet.,Tutorial A,,Filler,,Squash the Rot blocking your way.,,Head towards Spring Hamlet.,Tutorial A,,Filler,,Squash the Rot blocking your way.,,Head towards Spring Hamlet.,Tutorial A,,Filler,,Squash the Rot blocking your way.,,Head towards Spring Hamlet.,Portuguese - Title,Portuguese - Desc,Portuguese - Start Obj,Portuguese - Obj A,Portuguese - Obj B,Portuguese - Obj C,Portuguese - Final Obj,Korean - Title,Korean - Desc,Korean - Start Obj,Korean - Obj A,Korean - Obj B,Korean - Obj C,Korean - Final Obj,Spanish - Start Obj
tutorial1,Spring Hamlet,Tutorial B,0,,Retrieve your gift from Grannysmith.,r_springhamlet,Return to the Kindergarden.,r_kindergarden,Squash the Rot blocking your way.,r_riverway,,,,,Tutorial B,,Retrieve your gift from Grannysmith.,Return to the Kindergarden.,Talk to Elderberry.,,,Tutorial B,,Retrieve your gift from Grannysmith.,Return to the Kindergarden.,Talk to Elderberry.,,,Tutorial B,,Retrieve your gift from Grannysmith.,Return to the Kindergarden.,Talk to Elderberry.,,,Tutorial B,,Retrieve your gift from Grannysmith.,Return to the Kindergarden.,Talk to Elderberry.,,,Portuguese - Title,Portuguese - Desc,Portuguese - Start Obj,Portuguese - Obj A,Portuguese - Obj B,Portuguese - Obj C,Portuguese - Final Obj,Korean - Title,Korean - Desc,Korean - Start Obj,Korean - Obj A,Korean - Obj B,Korean - Obj C,Korean - Final Obj,Spanish - Start Obj
tutorial2,Spring Hamlet,Intro Start,0,,Get situated in your new home.,r_thebend,,,Talk to Elderberry.,r_thebend,,,,,Intro Start,,Get situated in your new home.,,,,,Intro Start,,Get situated in your new home.,,,,,Intro Start,,Get situated in your new home.,,,,,Intro Start,,Get situated in your new home.,,,,,Portuguese - Title,Portuguese - Desc,Portuguese - Start Obj,Portuguese - Obj A,Portuguese - Obj B,Portuguese - Obj C,Portuguese - Final Obj,Korean - Title,Korean - Desc,Korean - Start Obj,Korean - Obj A,Korean - Obj B,Korean - Obj C,Korean - Final Obj,Spanish - Start Obj
,,,,,,,,,,,,,,,,,,,Help Rana with Foraging.,,,,,,,Help Rana with Foraging.,,,,,,,Help Rana with Foraging.,,,,,,,Help Rana with Foraging.,,,,,,,,,,,,,,,,,
breather0,Spring Hamlet,Тихое Начало,0,"Рана говорит, что я должен подготовиться к первому рабочему дню исследуя Деревуню.",Поговори с Раной,,Помогите Ране с просьбами,r_riverway,Помоги Ране с добычей пищи.,r_docks,Помоги Ране справиться с Гнилью.,r_bellrow,,,A Quiet Beginning,Rana says I should prepare for the first work day by exploring the Hamlet.,Talk to Rana,Help Rana with Maintenance.,Achieve Conflict Level 2 in Spring Hamlet,Help Rana with the Rot.,,A Quiet Beginning,Rana says I should prepare for the first work day by exploring the Hamlet.,Talk to Rana,Help Rana with Maintenance.,Achieve Conflict Level 2 in Spring Hamlet,Help Rana with the Rot.,,A Quiet Beginning,Rana says I should prepare for the first work day by exploring the Hamlet.,Talk to Rana,Help Rana with Maintenance.,Achieve Conflict Level 2 in Spring Hamlet,Help Rana with the Rot.,,A Quiet Beginning,Rana says I should prepare for the first work day by exploring the Hamlet.,Talk to Rana,Help Rana with Maintenance.,Achieve Conflict Level 2 in Spring Hamlet,Help Rana with the Rot.,,Portuguese - Title,Portuguese - Desc,Portuguese - Start Obj,Portuguese - Obj A,Portuguese - Obj B,Portuguese - Obj C,Portuguese - Final Obj,Korean - Title,Korean - Desc,Korean - Start Obj,Korean - Obj A,Korean - Obj B,Korean - Obj C,Korean - Final Obj,Spanish - Start Obj
first_steps,Spring Hamlet,Первые Шаги,0,"Бедные жители деревни ищут новую надежду, за которую можно было бы уцепиться. Возможно, какая-нибудь работа восстановит их моральный дух.",Поговори с Раной,r_thebend,Выполни 5 просьб,,Достичь уровня конфликта 2 в Весенней деревушке,,Сломайт 10 ресурсных узелков.,,Поговори с Бузиной Днем.,r_springhamlet,First Steps,The grieving villagers seek a new hope to cling to. Perhaps some basic work will restore some of the Hamlet's morale!,Talk to Rana,Complete 5 Requests.,Activate the Remote Power-nodes.,Break 10 resources.,Talk to Elderberry in the Day.,First Steps,The grieving villagers seek a new hope to cling to. Perhaps some basic work will restore some of the Hamlet's morale!,Talk to Rana,Complete 5 Requests.,Activate the Remote Power-nodes.,Break 10 resources.,Talk to Elderberry in the Day.,First Steps,The grieving villagers seek a new hope to cling to. Perhaps some basic work will restore some of the Hamlet's morale!,Talk to Rana,Complete 5 Requests.,Activate the Remote Power-nodes.,Break 10 resources.,Talk to Elderberry in the Day.,First Steps,The grieving villagers seek a new hope to cling to. Perhaps some basic work will restore some of the Hamlet's morale!,Talk to Rana,Complete 5 Requests.,Activate the Remote Power-nodes.,Break 10 resources.,Talk to Elderberry in the Day.,Portuguese - Title,Portuguese - Desc,Portuguese - Start Obj,Portuguese - Obj A,Portuguese - Obj B,Portuguese - Obj C,Portuguese - Final Obj,Korean - Title,Korean - Desc,Korean - Start Obj,Korean - Obj A,Korean - Obj B,Korean - Obj C,Korean - Final Obj,Spanish - Start Obj
next_steps,Spring Hamlet,Следующие шаги,0,"Теперь, когда у тебя есть на что опереться, у нас появилсиь некоторые важные проблемы, которые необходимо решить.",Поговори с Бузиной в библиотеке.,r_springhamlet,Помогите Марсанне собрать Росу для Библиотеки.,r_springhamlet,Активируй Удаленные узлы питания.,r_bellrow,"Поговори с Бузиной, как только починят Библиотеку.",r_springhamlet,,,Next Steps,"Now that you've found your footing, we have some immediate issues that need resolving.",Talk to Elderberry in the Library.,Help Marsanne produce enough Dew for the Library.,Generate 4 books.,Talk to Elderberry once the Library is fixed.,,SPN Next Steps,"Now that you've found your footing, we have some immediate issues that need resolving.",Talk to Elderberry in the Library.,Help Marsanne produce enough Dew for the Library.,Generate 4 books.,Talk to Elderberry once the Library is fixed.,,SPN Next Steps,"Now that you've found your footing, we have some immediate issues that need resolving.",Talk to Elderberry in the Library.,Help Marsanne produce enough Dew for the Library.,Generate 4 books.,Talk to Elderberry once the Library is fixed.,,SPN Next Steps,"Now that you've found your footing, we have some immediate issues that need resolving.",Talk to Elderberry in the Library.,Help Marsanne produce enough Dew for the Library.,Generate 4 books.,Talk to Elderberry once the Library is fixed.,,Portuguese - Title,Portuguese - Desc,Portuguese - Start Obj,Portuguese - Obj A,Portuguese - Obj B,Portuguese - Obj C,Portuguese - Final Obj,Korean - Title,Korean - Desc,Korean - Start Obj,Korean - Obj A,Korean - Obj B,Korean - Obj C,Korean - Final Obj,Spanish - Start Obj
archives_begin,Spring Hamlet,Хорошие Книги,0,"С библиотекой жители деревни возжелали больше знаний, которые им так нужны!",Встретиться с Хакуреем в библиотеке.,r_springhamlet,,,Разблокируй 3 библиотечных Каталога.,r_archive,,,Поговори с Бузиной,r_springhamlet,The Good Books,"With the Library functional, the Villagers yearn for the knowledge the once held.",Meet Hakurei in the Library.,,Bring the Lily Spores back to Elderberry.,,Talk to Elderberry.,The Good Books,"With the Library functional, the Villagers yearn for the knowledge the once held.",Meet Hakurei in the Library.,,Bring the Lily Spores back to Elderberry.,,Talk to Elderberry.,The Good Books,"With the Library functional, the Villagers yearn for the knowledge the once held.",Meet Hakurei in the Library.,,Bring the Lily Spores back to Elderberry.,,Talk to Elderberry.,The Good Books,"With the Library functional, the Villagers yearn for the knowledge the once held.",Meet Hakurei in the Library.,,Bring the Lily Spores back to Elderberry.,,Talk to Elderberry.,Portuguese - Title,Portuguese - Desc,Portuguese - Start Obj,Portuguese - Obj A,Portuguese - Obj B,Portuguese - Obj C,Portuguese - Final Obj,Korean - Title,Korean - Desc,Korean - Start Obj,Korean - Obj A,Korean - Obj B,Korean - Obj C,Korean - Final Obj,Spanish - Start Obj
spr_dungeon1,Spring Hamlet,Попадание в Стеллажи,0,"В глубине Библиотеки чем-то пахнет. Вероятно это то, что препятствует нашему доступу к знаниям в Мягкой обложке.",Поговори с Бузиной.,r_springhamlet,Спустись на 5-й уровень Библиотечных стеллажей.,r_thestacks_a,Принесите споры Лилии обратно в Бузине.,r_archive,,,,,Hitting the Stacks,Something smells in the depths of the Library. Its presence is likely preventing our access to the Paperbark's knowledge.,Talk to Elderberry.,Descend to the 5th level of the Library's Stacks.,Cross the Lily Path to the Summer Bar when you're ready.,,,Hitting the Stacks,Something smells in the depths of the Library. Its presence is likely preventing our access to the Paperbark's knowledge.,Talk to Elderberry.,Descend to the 5th level of the Library's Stacks.,Cross the Lily Path to the Summer Bar when you're ready.,,,Hitting the Stacks,Something smells in the depths of the Library. Its presence is likely preventing our access to the Paperbark's knowledge.,Talk to Elderberry.,Descend to the 5th level of the Library's Stacks.,Cross the Lily Path to the Summer Bar when you're ready.,,,Hitting the Stacks,Something smells in the depths of the Library. Its presence is likely preventing our access to the Paperbark's knowledge.,Talk to Elderberry.,Descend to the 5th level of the Library's Stacks.,Cross the Lily Path to the Summer Bar when you're ready.,,,Portuguese - Title,Portuguese - Desc,Portuguese - Start Obj,Portuguese - Obj A,Portuguese - Obj B,Portuguese - Obj C,Portuguese - Final Obj,Korean - Title,Korean - Desc,Korean - Start Obj,Korean - Obj A,Korean - Obj B,Korean - Obj C,Korean - Final Obj,Spanish - Start Obj
spr_end,Spring Hamlet,Первое Прощание,0,"Стеллажи покорены, путь Конкорда к Летнему бару уже близок.",Встретимся с Бузиной рядом с Дорожкой из Лилий.,r_shellcove,,,"Когда будешь готовы, пройди по Тропинке Лилий к Летнему бару.",r_shellcove,,,,,The First Farewell,"The Stacks conquered, Concord's path to the Summer Bar is within reach.",Meet Elderberry next to the Lily Path.,,,,,The First Farewell,"The Stacks conquered, Concord's path to the Summer Bar is within reach.",Meet Elderberry next to the Lily Path.,,,,,The First Farewell,"The Stacks conquered, Concord's path to the Summer Bar is within reach.",Meet Elderberry next to the Lily Path.,,,,,The First Farewell,"The Stacks conquered, Concord's path to the Summer Bar is within reach.",Meet Elderberry next to the Lily Path.,,,,,Portuguese - Title,Portuguese - Desc,Portuguese - Start Obj,Portuguese - Obj A,Portuguese - Obj B,Portuguese - Obj C,Portuguese - Final Obj,Korean - Title,Korean - Desc,Korean - Start Obj,Korean - Obj A,Korean - Obj B,Korean - Obj C,Korean - Final Obj,Spanish - Start Obj
,,,0,,,,,,,,,,,,,,,,Find a place to stay.,,,,,,,Find a place to stay.,,,,,,,Find a place to stay.,,,,,,,Find a place to stay.,,,,,,,,,,,,,,,,,
smr_start,Summer Bar,За морем,0,Бузина умоляет тебя найти архитектора Фудзи. В последний раз его видели направлявшимися в Летний Бар.,Make your way to the Summer Bar.,r_lilylanding,Meet Fuji in Quiet Shore.,r_quietshore,Find a place to stay.,r_quietshore,,,,,Beyond the Sea,"Elderberry implores you to find Fuji, the architect. They were last seen heading towards the Summer Bar.",Make your way to the Summer Bar.,Meet Fuji in Quiet Shore.,Pull 10 items from the ocean.,,,Beyond the Sea,"Elderberry implores you to find Fuji, the architect. They were last seen heading towards the Summer Bar.",Make your way to the Summer Bar.,Meet Fuji in Quiet Shore.,Pull 10 items from the ocean.,,,Beyond the Sea,"Elderberry implores you to find Fuji, the architect. They were last seen heading towards the Summer Bar.",Make your way to the Summer Bar.,Meet Fuji in Quiet Shore.,Pull 10 items from the ocean.,,,Beyond the Sea,"Elderberry implores you to find Fuji, the architect. They were last seen heading towards the Summer Bar.",Make your way to the Summer Bar.,Meet Fuji in Quiet Shore.,Pull 10 items from the ocean.,,,,,,,,,,,,,,,,,
smr_town,Summer Bar,Летний Путь,0,"Фудзи жив и здоров, но просит вас помочь Сагуаро - смотрителю Заставы Виста.",Talk to Saguaro,r_vistaoutpost,Obtain a Dowsing Rod from Coqui.,r_summerend,Pull 10 items from the ocean.,,Deposit 5 kinds of materials into Storage,r_quietshore,Talk to Saguaro,r_vistaoutpost,The Summer Way,"Fuji's healthy and active, but asks that you help Saguaro, the Caretaker of Vista Outpost.",Talk to Saguaro,Obtain a Dowsing Rod from Coqui.,Learn building from Fuji,Deposit 5 kinds of materials into Village Storage.,Talk to Saguaro,The Summer Way,"Fuji's healthy and active, but asks that you help Saguaro, the Caretaker of Vista Outpost.",Talk to Saguaro,Obtain a Dowsing Rod from Coqui.,Learn building from Fuji,Deposit 10 materials into the Village Stores.,Talk to Saguaro,The Summer Way,"Fuji's healthy and active, but asks that you help Saguaro, the Caretaker of Vista Outpost.",Talk to Saguaro,Obtain a Dowsing Rod from Coqui.,Learn building from Fuji,Deposit 10 materials into the Village Stores.,Talk to Saguaro,The Summer Way,"Fuji's healthy and active, but asks that you help Saguaro, the Caretaker of Vista Outpost.",Talk to Saguaro,Obtain a Dowsing Rod from Coqui.,Learn building from Fuji,Deposit 10 materials into the Village Stores.,Talk to Saguaro,,,,,,,,,,,,,,,
smr_rebuild,Summer Bar,Постройка Мостов,0,С помощью Мастерской можно построить дорогу к Лилипутам. Фудзи уже готов.,Talk to Fuji,r_quietshore,Achieve Maintenance Level 2 in Summer Bar,,Learn building from Fuji,r_quietshore,Repair the bridge to Lilyputt.,r_summerstart,Talk to Rio,r_summerstart,Building Bridges,"With a working the Workshop, the way to Lilyputt can be built. Fuji stands ready.",Talk to Fuji,Achieve Maintenance Level 2 in Summer Bar,Find the lost Carpenter.,Repair the bridge to Lilyputt.,Talk to Rio,Building Bridges,"With a working the Workshop, the way to Lilyputt can be built. Fuji stands ready.",Talk to Fuji,Achieve Maintenance Level 2 in Summer Bar,Find the lost Carpenter.,Repair the bridge to Lilyputt.,Talk to Rio,Building Bridges,"With a working the Workshop, the way to Lilyputt can be built. Fuji stands ready.",Talk to Fuji,Achieve Maintenance Level 2 in Summer Bar,Find the lost Carpenter.,Repair the bridge to Lilyputt.,Talk to Rio,Building Bridges,"With a working the Workshop, the way to Lilyputt can be built. Fuji stands ready.",Talk to Fuji,Achieve Maintenance Level 2 in Summer Bar,Find the lost Carpenter.,Repair the bridge to Lilyputt.,Talk to Rio,,,,,,,,,,,,,,,
smr_dngn,Summer Bar,Проблемы Плотника,0,Woody went to the Waterlog to find materials for Lilyputt. Only Concord can retrieve them from the dungeon.,Talk to Saguaro,r_vistaoutpost,Descend 7 levels into the Waterlog.,r_waterlog_a,Find Woody in the Waterlog.,r_waterlog_a,,,Talk to Saguaro,r_vistaoutpost,Carpenter in Crisis,Carpenter went to the Waterlog to find materials for Lilyputt. Only Concord can retrieve them from the dungeon.,Talk to Saguaro,Descend 7 levels into the Waterlog.,Talk to Fuji at the Workshop.,,Talk to Saguaro,Carpenter in Crisis,Carpenter went to the Waterlog to find materials for Lilyputt. Only Concord can retrieve them from the dungeon.,Talk to Saguaro,Descend 7 levels into the Waterlog.,Talk to Fuji at the Workshop.,,Talk to Saguaro,Carpenter in Crisis,Carpenter went to the Waterlog to find materials for Lilyputt. Only Concord can retrieve them from the dungeon.,Talk to Saguaro,Descend 7 levels into the Waterlog.,Talk to Fuji at the Workshop.,,Talk to Saguaro,Carpenter in Crisis,Carpenter went to the Waterlog to find materials for Lilyputt. Only Concord can retrieve them from the dungeon.,Talk to Saguaro,Descend 7 levels into the Waterlog.,Talk to Fuji at the Workshop.,,Talk to Saguaro,,,,,,,,,,,,,,,
smr_end,Spring Hamlet,Возвращение к Весне,0,Застава работает и Конкорд должен вернуться в Весеннюю деревню с Фудзи.,Return to Spring Hamlet.,r_shellcove,,,Talk to Fuji at the Workshop.,r_testroom,,,Talk to Fuji,r_grandsquare,Return to Spring,"The Outpost is in working order, and Concord must return with Fuji to Spring Hamlet.",Talk to Elderberry,,Repair the Lift.,,Talk to Fuji,Return to Spring,"The Outpost is in working order, and Concord must return with Fuji to Spring Hamlet.",Talk to Elderberry,,Repair the Lift.,,Talk to Fuji,Return to Spring,"The Outpost is in working order, and Concord must return with Fuji to Spring Hamlet.",Talk to Elderberry,,Repair the Lift.,,Talk to Fuji,Return to Spring,"The Outpost is in working order, and Concord must return with Fuji to Spring Hamlet.",Talk to Elderberry,,Repair the Lift.,,Talk to Fuji,,,,,,,,,,,,,,,
smr_to_atm,Spring Hamlet,Восстановление от гнили,0,"Многолетняя площадь очищена, и жители деревни ищут дорогу к Осеннему городу.",Clear Perennial Plaza of Rot.,r_grandsquare,Return to Fuji's Workshop.,r_testroom,Repair the Lift.,r_grandsquare,Talk to Plum,r_docks,Take the Lift up to Autumn Town,r_grandsquare,Reclamation from Rot,"Perennial Plaza is cleared, and the Villagers seek ways to connect to Autumn Town.",Clear Perennial Plaza of Rot.,Return to Fuji's Workshop.,Talk to the Architect of Autumn Town.,Talk to Plum,Take the Lift up to Autumn Town,Reclamation from Rot,"Perennial Plaza is cleared, and the Villagers seek ways to connect to Autumn Town.",Clear Perennial Plaza of Rot.,Return to Fuji's Workshop.,Talk to the Architect of Autumn Town.,Talk to Plum,Take the Lift up to Autumn Town,Reclamation from Rot,"Perennial Plaza is cleared, and the Villagers seek ways to connect to Autumn Town.",Clear Perennial Plaza of Rot.,Return to Fuji's Workshop.,Talk to the Architect of Autumn Town.,Talk to Plum,Take the Lift up to Autumn Town,Reclamation from Rot,"Perennial Plaza is cleared, and the Villagers seek ways to connect to Autumn Town.",Clear Perennial Plaza of Rot.,Return to Fuji's Workshop.,Talk to the Architect of Autumn Town.,Talk to Plum,Take the Lift up to Autumn Town,,,,,,,,,,,,,,,
atm_start,Autumn Town,Осеннее равноденствие,0,"Настоящее состояние Осеннего города неизвестно, Деревня по-прежнему надеется, что Конкорд сможет найти туда дорогу.",Establish Contact with Autumn Town,r_cityroad,Talk to the Trader of Autumn Town.,r_wheatfield,Talk to the Architect of Autumn Town.,r_wheatfield,,,,,Autumnal Equinox,"The true state of Autumn Town unknown, the Hamlet remains hopeful Concord can find a way to help them.",Establish Contact with Autumn Town,Talk to the Trader of Autumn Town.,Rebuild the way to Plantation Village.,,,Autumnal Equinox,"The true state of Autumn Town unknown, the Hamlet remains hopeful Concord can find a way to help them.",Establish Contact with Autumn Town,Talk to the Trader of Autumn Town.,Rebuild the way to Plantation Village.,,,Autumnal Equinox,"The true state of Autumn Town unknown, the Hamlet remains hopeful Concord can find a way to help them.",Establish Contact with Autumn Town,Talk to the Trader of Autumn Town.,Rebuild the way to Plantation Village.,,,Autumnal Equinox,"The true state of Autumn Town unknown, the Hamlet remains hopeful Concord can find a way to help them.",Establish Contact with Autumn Town,Talk to the Trader of Autumn Town.,Rebuild the way to Plantation Village.,,,,,,,,,,,,,,,,,
atm_mid_a,Autumn Town,В Деревню Плантаций,0,"Осенний город явно находится в тяжелом положении, и у Конкорда есть проблемы даже с тем, чтобы добраться до Деревни Плантаций.",Talk to Kalo.,r_wheatfield,Get a Sickle from Calabasa,r_wheatfield,Rebuild the way to Plantation Village.,r_puzzleplateau,,,Talk to Haupia of Plantation Village.,r_plantationvillage,To Plantation Village,"Autumn Town is clearly in dire straits, and Concord has issues even reaching Plantation Village.",Talk to Kalo.,,Restore waterflow to Autumn Town.,,Talk to Haupia of Plantation Village.,To Plantation Village,"Autumn Town is clearly in dire straits, and Concord has issues even reaching Plantation Village.",Talk to Kalo.,,Restore waterflow to Autumn Town.,,Talk to Haupia of Plantation Village.,To Plantation Village,"Autumn Town is clearly in dire straits, and Concord has issues even reaching Plantation Village.",Talk to Kalo.,,Restore waterflow to Autumn Town.,,Talk to Haupia of Plantation Village.,To Plantation Village,"Autumn Town is clearly in dire straits, and Concord has issues even reaching Plantation Village.",Talk to Kalo.,,Restore waterflow to Autumn Town.,,Talk to Haupia of Plantation Village.,,,,,,,,,,,,,,,
atm_mid_b,Autumn Town,Опасности сантехники,0,"Мэр Хаупиа не верит Весенней деревне, его нужно убедить.",,,Reach Level 10 of the Sewers,r_sewers_a,Restore waterflow to Autumn Town.,r_sewers_a,,,Talk to Haupia of Plantation Village.,r_plantationvillage,The Perils of Plumbing,Mayor Haupia has no faith in Spring Hamlet and requires convincing.,,Reach Level 10 of the Sewers,Clear the First Steppe of debris.,,Talk to Haupia of Plantation Village.,The Perils of Plumbing,Mayor Haupia has no faith in Spring Hamlet and requires convincing.,,Reach Level 10 of the Sewers,Clear the First Steppe of debris.,,Talk to Haupia of Plantation Village.,The Perils of Plumbing,Mayor Haupia has no faith in Spring Hamlet and requires convincing.,,Reach Level 10 of the Sewers,Clear the First Steppe of debris.,,Talk to Haupia of Plantation Village.,The Perils of Plumbing,Mayor Haupia has no faith in Spring Hamlet and requires convincing.,,Reach Level 10 of the Sewers,Clear the First Steppe of debris.,,Talk to Haupia of Plantation Village.,,,,,,,,,,,,,,,
atm_mid_c,Autumn Town,Зов Ферм,0,С Деревни Плантаций Конкорду нужно сделать всего один рывок на пути к Многолетней площади,Talk to Kabocha.,r_puzzleplateau,Achieve Forage Level 2 in Autumn Town,r_wheatfield,Clear the First Steppe of debris.,r_firststeppe,Clear the Walkabout of Rot.,r_breezywalkabout,Talk to Haupia of Plantation Village.,r_plantationvillage,A Call To Farms,"With Plantation Village behind Concord, the last push to Perennial Plaza can be made.",Talk to Kabocha.,Achieve Forage Level 2 in Autumn Town,Meet Rana at the Grove's base.,Clear the Walkabout of Rot.,Talk to Haupia of Plantation Village.,A Call To Farms,"With Plantation Village behind Concord, the last push to Perennial Plaza can be made.",Talk to Kabocha.,Achieve Forage Level 2 in Autumn Town,Meet Rana at the Grove's base.,Clear the Walkabout of Rot.,Talk to Haupia of Plantation Village.,A Call To Farms,"With Plantation Village behind Concord, the last push to Perennial Plaza can be made.",Talk to Kabocha.,Achieve Forage Level 2 in Autumn Town,Meet Rana at the Grove's base.,Clear the Walkabout of Rot.,Talk to Haupia of Plantation Village.,A Call To Farms,"With Plantation Village behind Concord, the last push to Perennial Plaza can be made.",Talk to Kabocha.,Achieve Forage Level 2 in Autumn Town,Meet Rana at the Grove's base.,Clear the Walkabout of Rot.,Talk to Haupia of Plantation Village.,,,,,,,,,,,,,,,
