 ,town,Title,Sprite,Description,Begin Objective,room,Obj A,room,Obj B,room,Obj C,room,Completion Obj,room,Chinese - Title,Chinese - Desc,Chinese - Start Obj,Chinese - Obj A,Chinese - Obj B,Chinese - Obj C,Chinese - Final Obj,Spanish - Title,Spanish - Desc,Spanish Star Obj,Spanish - Obj A,Spanish - Obj B,Spanish - Obj C,Spanish - Final Obj,French - Title,French - Desc,French - Start Obj,French - Obj A,French - Obj B,French - Obj C,French - Final Obj,Japanese - Title,Japanese - Desc,Japanese - Start Obj,Japanese - Obj A,Japanese - Obj B,Japanese - Obj C,Japanese - Final Obj,Portuguese - Title,Portuguese - Desc,Portuguese - Start Obj,Portuguese - Obj A,Portuguese - Obj B,Portuguese - Obj C,Portuguese - Final Obj,Korean - Title,Korean - Desc,Korean - Start Obj,Korean - Obj A,Korean - Obj B,Korean - Obj C,Korean - Final Obj,Spanish - Start Obj
atm_end,Autumn Town,Побег из города,0,"Теперь, когда торговый путь проложен, Конкорду нужно вернуться в Весеннюю Деревню.",Return to Spring Hamlet and talk to Elderberry.,r_grandsquare,Talk to Negi in the Docks,r_docks,Meet Rana at the Grove's base.,r_babblebrook,,,,,City Escape,"With the trade route secured, Concord only needs to return to Spring Hamlet.",Talk to Elderberry,Talk to Negi in the Docks,Meet Elderberry at the Kindergarden.,,,City Escape,"With the trade route secured, Concord only needs to return to Spring Hamlet.",Talk to Elderberry,Talk to Negi in the Docks,Meet Elderberry at the Kindergarden.,,,City Escape,"With the trade route secured, Concord only needs to return to Spring Hamlet.",Talk to Elderberry,Talk to Negi in the Docks,Meet Elderberry at the Kindergarden.,,,City Escape,"With the trade route secured, Concord only needs to return to Spring Hamlet.",Talk to Elderberry,Talk to Negi in the Docks,Meet Elderberry at the Kindergarden.,,,,,,,,,,,,,,,,,
atm_to_wtr,Spring Hamlet,Направляясь на Восток,0,По мере роста Деревни крепнут и ее враги. Бузина просит помощи у Зимней Чащи.,,,,,Meet Elderberry at the Kindergarden.,r_kindergarden,,,Meet Terong to enter Winter Glade.,r_bellrow,Eastward Bound,"As the Hamlet grows, so does its enemies. Elderberry requests the aid of Winter Thicket.",,,Bring Plum back from the Mists.,,Meet Terong in Bell Row once you're ready.,Eastward Bound,"As the Hamlet grows, so does its enemies. Elderberry requests the aid of Winter Thicket.",,,Bring Plum back from the Mists.,,Meet Terong in Bell Row once you're ready.,Eastward Bound,"As the Hamlet grows, so does its enemies. Elderberry requests the aid of Winter Thicket.",,,Bring Plum back from the Mists.,,Meet Terong in Bell Row once you're ready.,Eastward Bound,"As the Hamlet grows, so does its enemies. Elderberry requests the aid of Winter Thicket.",,,Bring Plum back from the Mists.,,Meet Terong in Bell Row once you're ready.,,,,,,,,,,,,,,,
wtr_start,Winter Thicket,В Холодные Леса,0,Письмо с призывом попало Конкорду и он направляется к закрытой Зимней Поляне.,Make your way East of the Forest.,r_winterglade,,,Bring Plum back from the Mists.,r_themists,,,,,To Frigid Forests,"A letter of summons has found its way to Concord, directing them toward the reclusive Winter Glade.",Make your way East of the Forest.,,Clear the Rot from the Mists' Epitaphs.,,,To Frigid Forests,"A strange letter has found its way to Concord, directing them toward the reclusive Winter Glade.",Make your way East of the Forest.,,Clear the Rot from the Mists' Epitaphs.,,,To Frigid Forests,"A strange letter has found its way to Concord, directing them toward the reclusive Winter Glade.",Make your way East of the Forest.,,Clear the Rot from the Mists' Epitaphs.,,,To Frigid Forests,"A strange letter has found its way to Concord, directing them toward the reclusive Winter Glade.",Make your way East of the Forest.,,Clear the Rot from the Mists' Epitaphs.,,,,,,,,,,,,,,,,,
wtr_mid_a,Winter Thicket,Глубокий Белый,0,Не имея возможности исследовать Туманы Слива сильно огорчается и приходит в уныние.,Talk to Plum.,r_winterglade,,,Clear the Rot from the Mists' Epitaphs.,r_themists,,,Talk to Ledidi,r_brokenblockade,The Deep White,"Unable to explore the Mists, Plum is disheartened from their failure.",Talk to Plum.,Talk to Ledidi,Find Mandy within the depths of the Mists.,,Talk to Ledidi,The Deep White,"Unable to explore the Mists, Plum is disheartened from their failure.",Talk to Plum.,Talk to Ledidi,Find Mandy within the depths of the Mists.,,Talk to Ledidi,The Deep White,"Unable to explore the Mists, Plum is disheartened from their failure.",Talk to Plum.,Talk to Ledidi,Find Mandy within the depths of the Mists.,,Talk to Ledidi,The Deep White,"Unable to explore the Mists, Plum is disheartened from their failure.",Talk to Plum.,Talk to Ledidi,Find Mandy within the depths of the Mists.,,Talk to Ledidi,,,,,,,,,,,,,,,
wtr_mid_b,Winter Thicket,Дом Солнца,0,"Having acknowledged their progress, Ledidi bequeaths Plum's quest to Concord.",,,,,Find Mandy within the depths of the Mists.,r_themists,,,Talk to Plum.,r_winterglade,House of the Sun,"Having acknowledged their progress, Plum bequeaths an old debt to Concord.",Talk to Plum.,,,,Talk to Ledidi,House of the Sun,"Having acknowledged their progress, Plum bequeaths an old debt to Concord.",Talk to Plum.,,,,Talk to Ledidi,House of the Sun,"Having acknowledged their progress, Plum bequeaths an old debt to Concord.",Talk to Plum.,,,,Talk to Ledidi,House of the Sun,"Having acknowledged their progress, Plum bequeaths an old debt to Concord.",Talk to Plum.,,,,Talk to Ledidi,,,,,,,,,,,,,,,
wtr_mid_c,Winter Thicket,Наружу и вверх,0,"Winter Glade stirring with new developments, Concord must consider the way forward.",Talk to Ledidi.,r_brokenblockade,,,,,,,,,Outward and Upward,"Winter Glad stirring with new developments, Concord must consider the way forward.",Talk to Plum.,,Retrieve a shard from the Waterlog.,,Talk to Ledidi,Outward and Upward,"Winter Glad stirring with new developments, Concord must consider the way forward.",Talk to Plum.,,Retrieve a shard from the Waterlog.,,Talk to Ledidi,Outward and Upward,"Winter Glad stirring with new developments, Concord must consider the way forward.",Talk to Plum.,,Retrieve a shard from the Waterlog.,,Talk to Ledidi,Outward and Upward,"Winter Glad stirring with new developments, Concord must consider the way forward.",Talk to Plum.,,Retrieve a shard from the Waterlog.,,Talk to Ledidi,,,,,,,,,,,,,,,
wtr_end,Winter Thicket,Последний Толчок,0,The Silver Sword is in hand. Concord has proven themselves to the Mists.,Leave Winter Glade.,r_bellrow,Retrieve a shard from the Archives.,r_springhamlet,Retrieve a shard from the Waterlog.,r_waterlog_a,Retrieve a shard from the Sewers.,r_sewer_a,Talk to Mandy,r_mists_temple,The Last Push,The Silver Sword is in hand. Concord has to proven themselves to the Rot.,Leave Winter Glade.,Retrieve a shard from the Archives.,,Retrieve a shard from the Sewers.,Talk to Mandy,The Last Push,The Silver Sword is in hand. Concord has to proven themselves to the Rot.,Leave Winter Glade.,Retrieve a shard from the Archives.,,Retrieve a shard from the Sewers.,Talk to Mandy,The Last Push,The Silver Sword is in hand. Concord has to proven themselves to the Rot.,Leave Winter Glade.,Retrieve a shard from the Archives.,,Retrieve a shard from the Sewers.,Talk to Mandy,The Last Push,The Silver Sword is in hand. Concord has to proven themselves to the Rot.,Leave Winter Glade.,Retrieve a shard from the Archives.,,Retrieve a shard from the Sewers.,Talk to Mandy,,,,,,,,,,,,,,,
end_a,Spring Hamlet,Путешествие в центр Рощи,0,The hearts of each region have been united. The Grove's depths beckon....,Open the Temple doors.,r_mists_temple,,,,,,,Part the crystal from the Grove.,r_temple_inner,Journey to the Center of the Grove,The hearts of each region have been united. The Grove's depths beckon....,Open the Temple doors.,,,,Part the crystal from the Grove.,Journey to the Center of the Grove,The hearts of each region have been united. The Grove's depths beckon....,Open the Temple doors.,,,,Part the crystal from the Grove.,Journey to the Center of the Grove,The hearts of each region have been united. The Grove's depths beckon....,Open the Temple doors.,,,,Part the crystal from the Grove.,Journey to the Center of the Grove,The hearts of each region have been united. The Grove's depths beckon....,Open the Temple doors.,,,,Part the crystal from the Grove.,,,,,,,,,,,,,,,
end_b,Spring Hamlet,Один на один,0,"Concord has bested the Grove's Clutch, but its grip still lingers.",,,,,,,,,Commune with the Grove.,r_theworld,One on One,"Concord has bested the Grove's Clutch, but its grip still lingers.",,,Reconvene with the village elders in Vista Outpost.,,Commune with the Grove.,One on One,"Concord has bested the Grove's Clutch, but its grip still lingers.",,,Reconvene with the village elders in Vista Outpost.,,Commune with the Grove.,One on One,"Concord has bested the Grove's Clutch, but its grip still lingers.",,,Reconvene with the village elders in Vista Outpost.,,Commune with the Grove.,One on One,"Concord has bested the Grove's Clutch, but its grip still lingers.",,,Reconvene with the village elders in Vista Outpost.,,Commune with the Grove.,,,,,,,,,,,,,,,
end_c,Spring Hamlet,Жесткая борьба,0,"Injured from the fight, Concord must refresh themselves on the waking world.",Catch up with old friends.,r_kindergarden,,,Talk to Plum.,r_kindergarden,,,Tend to the Kindergarden Vine once more.,r_kindergarden,New World,"Injured from the fight, Concord must refresh themselves on the waking world.",Talk to friends.,,Help the Towns recover.,,,New World,"Injured from the fight, Concord must refresh themselves on the waking world.",Talk to friends.,,Help the Towns recover.,,,New World,"Injured from the fight, Concord must refresh themselves on the waking world.",Talk to friends.,,Help the Towns recover.,,,New World,"Injured from the fight, Concord must refresh themselves on the waking world.",Talk to friends.,,Help the Towns recover.,,,,,,,,,,,,,,,,,
epilogue,Spring Hamlet,Новый Мир,0,"The Grove is finally at peace, ushering in a new era for its denizens.",Let Rana bother you.,r_kindergarden,,,Reconvene with the village elders in Vista Outpost.,r_vistaoutpost,,,Enjoy the newfound peace.,,To Be Continued...,"The Grove is finally at peace, ushering in a new era for its denizens.",,,,,,To Be Continued...,"The Grove is finally at peace, ushering in a new era for its denizens.",,,,,,To Be Continued...,"The Grove is finally at peace, ushering in a new era for its denizens.",,,,,,To Be Continued...,"The Grove is finally at peace, ushering in a new era for its denizens.",,,,,,,,,,,,,,,,,,,,
,,,,,,,,,,,,,,,,,,,,,,,,,,,,,,,,,,,,,,,,,,,,,,,,,,,,,,,,,
,,,,,,,,,,,,,,,,,,,,,,,,,,,,,,,,,,,,,,,,,,,,,,,,,,,,,,,,,
demo_0,Autumn Town,Путешествие Вверх,1,"Now that the Hamlet is thriving, people seek to reconnect with the remnants of Autumn Town.",Head up using Perennial Plaza's Lift.,,,,,,,,,,The Trip Up,"Now that the Hamlet is thriving, people seek to reconnect with the remnants of Autumn Town.",Head up using Perennial Plaza's Lift.,,,,,The Trip Up,"Now that the Hamlet is thriving, people seek to reconnect with the remnants of Autumn Town.",Head up using Perennial Plaza's Lift.,,,,,The Trip Up,"Now that the Hamlet is thriving, people seek to reconnect with the remnants of Autumn Town.",Head up using Perennial Plaza's Lift.,,,,,The Trip Up,"Now that the Hamlet is thriving, people seek to reconnect with the remnants of Autumn Town.",Head up using Perennial Plaza's Lift.,,,,,,,,,,,,,,,,,,,
demo_1,Autumn Town,Возвращение в Осенний город,1,"Now that the Hamlet is thriving, people seek to reconnect with the remnants of Autumn Town.",Talk to Fuji.,,Meet Fuji and Rana inside.,,,,,,,,Return to Autumn Town,"Now that the Hamlet is thriving, people seek to reconnect with the remnants of Autumn Town.",Talk to Fuji.,Meet Fuji and Rana inside.,Obtain Access to the Sewers.,,,Return to Autumn Town,"Now that the Hamlet is thriving, people seek to reconnect with the remnants of Autumn Town.",Talk to Fuji.,Meet Fuji and Rana inside.,Obtain Access to the Sewers.,,,Return to Autumn Town,"Now that the Hamlet is thriving, people seek to reconnect with the remnants of Autumn Town.",Talk to Fuji.,Meet Fuji and Rana inside.,Obtain Access to the Sewers.,,,Return to Autumn Town,"Now that the Hamlet is thriving, people seek to reconnect with the remnants of Autumn Town.",Talk to Fuji.,Meet Fuji and Rana inside.,Obtain Access to the Sewers.,,,,,,,,,,,,,,,,,
demo_2,Autumn Town,Возвращение в Осенний город,1,"Autumn Town is in ruins, and Fuji is exploring ways to help them.",Talk to Rana.,r_city_road,Help Rana complete Requests.,,Obtain Access to the Sewers.,r_puzzleplateau,,,Accompany Rana into the Sewers,,Return to Autumn Town,"Autumn Town is in ruins, and Fuji is exploring ways to help them.",Talk to Rana.,Help Rana complete Requests.,,,Accompany Rana into the Sewers,Return to Autumn Town,"Autumn Town is in ruins, and Fuji is exploring ways to help them.",Talk to Rana.,Help Rana complete Requests.,,,Accompany Rana into the Sewers,Return to Autumn Town,"Autumn Town is in ruins, and Fuji is exploring ways to help them.",Talk to Rana.,Help Rana complete Requests.,,,Accompany Rana into the Sewers,Return to Autumn Town,"Autumn Town is in ruins, and Fuji is exploring ways to help them.",Talk to Rana.,Help Rana complete Requests.,,,Accompany Rana into the Sewers,,,,,,,,,,,,,,,
